{
  "$schema": "https://json-schema.org/draft/2020-12/schema",
  "$id": "https://xcodebuildmcp.com/schemas/structured-output/xcodebuildmcp.output.project-list/2.schema.json",
  "type": "object",
  "additionalProperties": false,
  "allOf": [
    {
      "$ref": "https://xcodebuildmcp.com/schemas/structured-output/_defs/common.schema.json#/$defs/errorConsistency"
    }
  ],
  "properties": {
    "schema": {
      "const": "xcodebuildmcp.output.project-list"
    },
    "schemaVersion": {
      "const": "2"
    },
    "didError": {
      "type": "boolean"
    },
    "error": {
      "type": [
        "string",
        "null"
      ]
    },
    "data": {
      "type": "object",
      "additionalProperties": false,
      "properties": {
        "summary": {
          "type": "object",
          "additionalProperties": false,
          "properties": {
            "status": {
              "enum": [
                "SUCCEEDED",
                "FAILED"
              ]
            },
            "maxDepth": {
              "type": "integer",
              "minimum": 0
            },
            "projectCount": {
              "type": "integer",
              "minimum": 0
            },
            "workspaceCount": {
              "type": "integer",
              "minimum": 0
            }
          },
          "required": [
            "status",
            "maxDepth"
          ]
        },
        "artifacts": {
          "type": "object",
          "additionalProperties": false,
          "properties": {
            "workspaceRoot": {
              "type": "string"
            },
            "scanPath": {
              "type": "string"
            }
          },
          "required": [
            "workspaceRoot",
            "scanPath"
          ]
        },
        "projects": {
          "type": "array",
          "items": {
            "$ref": "https://xcodebuildmcp.com/schemas/structured-output/_defs/common.schema.json#/$defs/pathItem"
          }
        },
        "workspaces": {
          "type": "array",
          "items": {
            "$ref": "https://xcodebuildmcp.com/schemas/structured-output/_defs/common.schema.json#/$defs/pathItem"
          }
        },
        "diagnostics": {
          "$ref": "https://xcodebuildmcp.com/schemas/structured-output/_defs/common.schema.json#/$defs/basicDiagnostics"
        }
      },
      "required": [
        "summary",
        "artifacts",
        "projects",
        "workspaces"
      ]
    },
    "nextSteps": {
      "$ref": "https://xcodebuildmcp.com/schemas/structured-output/_defs/common.schema.json#/$defs/nextSteps"
    }
  },
  "required": [
    "schema",
    "schemaVersion",
    "didError",
    "error",
    "data"
  ]
}
